id,title,rank,university,university_full,department,deadline,is_new,reference,position_type,salary,start_date,apply_url,description
POLYU-260130014,Large language models for computational social science and FinTech applications,Other,PolyU,Hong Kong Polytechnic University,Department of Management and Marketing,2026-03-31,TRUE,260130014,Full-time,,,https://jobs.polyu.edu.hk/job_detail.php?job=260130014,Large language models for computational social science and FinTech applications — Department of Management and Marketing. See https://jobs.polyu.edu.hk/job_detail.php?job=260130014 for full details.
POLYU-260130010,"One health, molecular microbiology, bioinformatics",Other,PolyU,Hong Kong Polytechnic University,Department of Health Technology and Informatics,2026-02-06,FALSE,260130010,Full-time,,,https://jobs.polyu.edu.hk/job_detail.php?job=260130010,"One health, molecular microbiology, bioinformatics — Department of Health Technology and Informatics. See https://jobs.polyu.edu.hk/job_detail.php?job=260130010 for full details."
POLYU-260130009,"One health, molecular microbiology, bioinformatics",Other,PolyU,Hong Kong Polytechnic University,Department of Health Technology and Informatics,2026-02-06,FALSE,260130009,Full-time,,,https://jobs.polyu.edu.hk/job_detail.php?job=260130009,"One health, molecular microbiology, bioinformatics — Department of Health Technology and Informatics. See https://jobs.polyu.edu.hk/job_detail.php?job=260130009 for full details."
POLYU-260130007,Project Associate / Project Assistant (Full-time/Part-time),Other,PolyU,Hong Kong Polytechnic University,School of Nursing,2026-02-06,FALSE,260130007,Full-time,,,https://jobs.polyu.edu.hk/job_detail.php?job=260130007,Project Associate / Project Assistant (Full-time/Part-time) — School of Nursing. See https://jobs.polyu.edu.hk/job_detail.php?job=260130007 for full details.
POLYU-260130004,Investigation of strengthening mechanism and forming characteristics of medium-Mn steel under low-temperature hot stamping conditions,Other,PolyU,Hong Kong Polytechnic University,Department of Industrial and Systems Engineering,2026-02-06,FALSE,260130004,Full-time,,,https://jobs.polyu.edu.hk/job_detail.php?job=260130004,Investigation of strengthening mechanism and forming characteristics of medium-Mn steel under low-temperature hot stamping conditions — Department of Industrial and Systems Engineering. See https://jobs.polyu.edu.hk/job_detail.php?job=260130004 for full details.
POLYU-260130002,"Design of ultrastrong, ductile, and thermally stable nanocrystalline dual-phase alloys via coherent nano-honeycomb architecture",Other,PolyU,Hong Kong Polytechnic University,Department of Mechanical Engineering,2026-02-06,FALSE,260130002,Full-time,,,https://jobs.polyu.edu.hk/job_detail.php?job=260130002,"Design of ultrastrong, ductile, and thermally stable nanocrystalline dual-phase alloys via coherent nano-honeycomb architecture — Department of Mechanical Engineering. See https://jobs.polyu.edu.hk/job_detail.php?job=260130002 for full details."
POLYU-260129005,Elucidating the molecular mechanisms of a supplement as a novel myopia therapeutics by next generation proteomics,Other,PolyU,Hong Kong Polytechnic University,School of Optometry,2026-02-05,FALSE,260129005,Full-time,,,https://jobs.polyu.edu.hk/job_detail.php?job=260129005,Elucidating the molecular mechanisms of a supplement as a novel myopia therapeutics by next generation proteomics — School of Optometry. See https://jobs.polyu.edu.hk/job_detail.php?job=260129005 for full details.
POLYU-260129004,High-Q microcavity-enhanced AIE fluorescence spectroscopic optofluidic chips for selective and sensitive detection of water pollutants,Other,PolyU,Hong Kong Polytechnic University,Department of Electrical and Electronic Engineering,2026-07-15,TRUE,260129004,Full-time,,,https://jobs.polyu.edu.hk/job_detail.php?job=260129004,High-Q microcavity-enhanced AIE fluorescence spectroscopic optofluidic chips for selective and sensitive detection of water pollutants — Department of Electrical and Electronic Engineering. See https://jobs.polyu.edu.hk/job_detail.php?job=260129004 for full details.
POLYU-260129003,Smart aging fall preparedness: AI-screened personalized strategies integrating judo landing skills and fall biomechanics for community-dwelling older adults,Other,PolyU,Hong Kong Polytechnic University,Department of Rehabilitation Sciences,2026-02-05,FALSE,260129003,Full-time,,,https://jobs.polyu.edu.hk/job_detail.php?job=260129003,Smart aging fall preparedness: AI-screened personalized strategies integrating judo landing skills and fall biomechanics for community-dwelling older adults — Department of Rehabilitation Sciences. See https://jobs.polyu.edu.hk/job_detail.php?job=260129003 for full details.
POLYU-260129002,"Closed-loop, wearable sensor-based system for gait retraining in people with stroke",Other,PolyU,Hong Kong Polytechnic University,Department of Rehabilitation Sciences,2026-02-05,FALSE,260129002,Full-time,,,https://jobs.polyu.edu.hk/job_detail.php?job=260129002,"Closed-loop, wearable sensor-based system for gait retraining in people with stroke — Department of Rehabilitation Sciences. See https://jobs.polyu.edu.hk/job_detail.php?job=260129002 for full details."
POLYU-260129001,Health support project for persons with disabilities,Other,PolyU,Hong Kong Polytechnic University,Department of Rehabilitation Sciences,2026-02-05,FALSE,260129001,Full-time,,,https://jobs.polyu.edu.hk/job_detail.php?job=260129001,Health support project for persons with disabilities — Department of Rehabilitation Sciences. See https://jobs.polyu.edu.hk/job_detail.php?job=260129001 for full details.
POLYU-260128010,Development of cardiovascular stents which can regulate the pathological blood vessels,Other,PolyU,Hong Kong Polytechnic University,Department of Applied Biology and Chemical Technology,2026-02-04,FALSE,260128010,Full-time,,,https://jobs.polyu.edu.hk/job_detail.php?job=260128010,Development of cardiovascular stents which can regulate the pathological blood vessels — Department of Applied Biology and Chemical Technology. See https://jobs.polyu.edu.hk/job_detail.php?job=260128010 for full details.
POLYU-260128009,"Peptide-modified bone scaffolds that promote cell recruitment, reorganization and paracrine signalling for vascularized bone regeneration",Other,PolyU,Hong Kong Polytechnic University,Department of Applied Biology and Chemical Technology,2026-02-04,FALSE,260128009,Full-time,,,https://jobs.polyu.edu.hk/job_detail.php?job=260128009,"Peptide-modified bone scaffolds that promote cell recruitment, reorganization and paracrine signalling for vascularized bone regeneration — Department of Applied Biology and Chemical Technology. See https://jobs.polyu.edu.hk/job_detail.php?job=260128009 for full details."
POLYU-260128007,The Hong Kong Polytechnic University – Yunji Technology Hotel Digital Intelligence Joint Innovation Lab,Other,PolyU,Hong Kong Polytechnic University,Research Centre for Digital Transformation of Tourism,2026-02-04,FALSE,260128007,Full-time,,,https://jobs.polyu.edu.hk/job_detail.php?job=260128007,The Hong Kong Polytechnic University – Yunji Technology Hotel Digital Intelligence Joint Innovation Lab — Research Centre for Digital Transformation of Tourism. See https://jobs.polyu.edu.hk/job_detail.php?job=260128007 for full details.
POLYU-260128004,Research and clinical translation of drug activity in amyotrophic lateral sclerosis driven by biomarkers,Lecturer,PolyU,Hong Kong Polytechnic University,Department of Food Science and Nutrition,2026-02-04,FALSE,260128004,Full-time,,,https://jobs.polyu.edu.hk/job_detail.php?job=260128004,Research and clinical translation of drug activity in amyotrophic lateral sclerosis driven by biomarkers — Department of Food Science and Nutrition. See https://jobs.polyu.edu.hk/job_detail.php?job=260128004 for full details.
POLYU-260127016,Postdoctoral Fellow / Research Associate / Research Assistant (Full-time/Part-time),Postdoc,PolyU,Hong Kong Polytechnic University,Department of Logistics and Maritime Studies,2026-03-01,TRUE,260127016,Full-time,,,https://jobs.polyu.edu.hk/job_detail.php?job=260127016,Postdoctoral Fellow / Research Associate / Research Assistant (Full-time/Part-time) — Department of Logistics and Maritime Studies. See https://jobs.polyu.edu.hk/job_detail.php?job=260127016 for full details.
POLYU-260127014,Advancing spatial methodologies and applications toward scalable and explainable GeoAI,Other,PolyU,Hong Kong Polytechnic University,Department of Land Surveying and Geo-Informatics,2026-02-03,FALSE,260127014,Full-time,,,https://jobs.polyu.edu.hk/job_detail.php?job=260127014,Advancing spatial methodologies and applications toward scalable and explainable GeoAI — Department of Land Surveying and Geo-Informatics. See https://jobs.polyu.edu.hk/job_detail.php?job=260127014 for full details.
POLYU-260127013,Family-based financial literacy program,Other,PolyU,Hong Kong Polytechnic University,Jockey Club Design Institute for Social Innovation,2026-02-04,FALSE,260127013,Full-time,,,https://jobs.polyu.edu.hk/job_detail.php?job=260127013,Family-based financial literacy program — Jockey Club Design Institute for Social Innovation. See https://jobs.polyu.edu.hk/job_detail.php?job=260127013 for full details.
POLYU-260127010,Scaling up C-for-Chinese@JC in kindergarten sector to cultivate culturally responsive education,Other,PolyU,Hong Kong Polytechnic University,Department of Language Science and Technology,2026-02-03,FALSE,260127010,Full-time,,,https://jobs.polyu.edu.hk/job_detail.php?job=260127010,Scaling up C-for-Chinese@JC in kindergarten sector to cultivate culturally responsive education — Department of Language Science and Technology. See https://jobs.polyu.edu.hk/job_detail.php?job=260127010 for full details.
POLYU-260127009,Early diagnosis and treatment of children with autism spectrum disorder based on an integration of robot and augmented reality technology,Other,PolyU,Hong Kong Polytechnic University,Department of Language Science and Technology,2026-02-03,FALSE,260127009,Full-time,,,https://jobs.polyu.edu.hk/job_detail.php?job=260127009,Early diagnosis and treatment of children with autism spectrum disorder based on an integration of robot and augmented reality technology — Department of Language Science and Technology. See https://jobs.polyu.edu.hk/job_detail.php?job=260127009 for full details.
POLYU-260127008,Multimodal and multilingual individualised training in improving empathy and emotion recognition by autistic children combining robotics and AR technology,Other,PolyU,Hong Kong Polytechnic University,Department of Language Science and Technology,2026-02-03,FALSE,260127008,Full-time,,,https://jobs.polyu.edu.hk/job_detail.php?job=260127008,Multimodal and multilingual individualised training in improving empathy and emotion recognition by autistic children combining robotics and AR technology — Department of Language Science and Technology. See https://jobs.polyu.edu.hk/job_detail.php?job=260127008 for full details.
POLYU-260127007,The integration of two modalities: gesture and speech prosody in Cantonese focus marking in autistic and typical populations,Other,PolyU,Hong Kong Polytechnic University,Department of Language Science and Technology,2026-02-03,FALSE,260127007,Full-time,,,https://jobs.polyu.edu.hk/job_detail.php?job=260127007,The integration of two modalities: gesture and speech prosody in Cantonese focus marking in autistic and typical populations — Department of Language Science and Technology. See https://jobs.polyu.edu.hk/job_detail.php?job=260127007 for full details.
POLYU-260127006,Novel AI methods for science and engineering applications,Other,PolyU,Hong Kong Polytechnic University,Department of Applied Mathematics,2026-02-02,FALSE,260127006,Full-time,,,https://jobs.polyu.edu.hk/job_detail.php?job=260127006,Novel AI methods for science and engineering applications — Department of Applied Mathematics. See https://jobs.polyu.edu.hk/job_detail.php?job=260127006 for full details.
POLYU-260127002,Engineering vaccinia virus for enhanced immunotherapy of malignant mesothelioma,Other,PolyU,Hong Kong Polytechnic University,Department of Applied Biology and Chemical Technology,2026-02-10,FALSE,260127002,Full-time,,,https://jobs.polyu.edu.hk/job_detail.php?job=260127002,Engineering vaccinia virus for enhanced immunotherapy of malignant mesothelioma — Department of Applied Biology and Chemical Technology. See https://jobs.polyu.edu.hk/job_detail.php?job=260127002 for full details.
POLYU-260126022,Part-time Research Assistant,Other,PolyU,Hong Kong Polytechnic University,School of Accounting and Finance,2026-02-02,FALSE,260126022,Full-time,,,https://jobs.polyu.edu.hk/job_detail.php?job=260126022,Part-time Research Assistant — School of Accounting and Finance. See https://jobs.polyu.edu.hk/job_detail.php?job=260126022 for full details.
POLYU-260126020,Improving the functions and quality of life in population with visual impairments – i. m. VisionCare,Other,PolyU,Hong Kong Polytechnic University,School of Optometry,2026-02-02,FALSE,260126020,Full-time,,,https://jobs.polyu.edu.hk/job_detail.php?job=260126020,Improving the functions and quality of life in population with visual impairments – i. m. VisionCare — School of Optometry. See https://jobs.polyu.edu.hk/job_detail.php?job=260126020 for full details.
POLYU-260126019,Seeing through patients’ eyes: HiVE-enabled AR/xR immersive vision science with 3D disease simulations,Other,PolyU,Hong Kong Polytechnic University,School of Optometry,2026-02-02,FALSE,260126019,Full-time,,,https://jobs.polyu.edu.hk/job_detail.php?job=260126019,Seeing through patients’ eyes: HiVE-enabled AR/xR immersive vision science with 3D disease simulations — School of Optometry. See https://jobs.polyu.edu.hk/job_detail.php?job=260126019 for full details.
POLYU-260126018,Developing a flipped learning signature showcase,Other,PolyU,Hong Kong Polytechnic University,School of Nursing,2026-02-02,FALSE,260126018,Full-time,,,https://jobs.polyu.edu.hk/job_detail.php?job=260126018,Developing a flipped learning signature showcase — School of Nursing. See https://jobs.polyu.edu.hk/job_detail.php?job=260126018 for full details.
POLYU-260126017,Investigation of the effectiveness of virtual reality (VR) hypnosis in improving poor sleep among Chinese childhood cancer survivors: A mixed methods randomized controlled trial,Other,PolyU,Hong Kong Polytechnic University,School of Nursing,2026-02-02,FALSE,260126017,Full-time,,,https://jobs.polyu.edu.hk/job_detail.php?job=260126017,Investigation of the effectiveness of virtual reality (VR) hypnosis in improving poor sleep among Chinese childhood cancer survivors: A mixed methods randomized controlled trial — School of Nursing. See https://jobs.polyu.edu.hk/job_detail.php?job=260126017 for full details.
POLYU-260126015,Evidence-driven analytics for civil engineering education: enhancing student success and curriculum quality,Other,PolyU,Hong Kong Polytechnic University,Department of Civil and Environmental Engineering,2026-02-02,FALSE,260126015,Full-time,,,https://jobs.polyu.edu.hk/job_detail.php?job=260126015,Evidence-driven analytics for civil engineering education: enhancing student success and curriculum quality — Department of Civil and Environmental Engineering. See https://jobs.polyu.edu.hk/job_detail.php?job=260126015 for full details.
POLYU-260126014,Retinal ON-pathway stimulation during digital screen usage – a novel myopia treatment regimen,Other,PolyU,Hong Kong Polytechnic University,School of Optometry,2026-02-09,FALSE,260126014,Full-time,,,https://jobs.polyu.edu.hk/job_detail.php?job=260126014,Retinal ON-pathway stimulation during digital screen usage – a novel myopia treatment regimen — School of Optometry. See https://jobs.polyu.edu.hk/job_detail.php?job=260126014 for full details.
POLYU-260126009,"Interactive virtual environments for transcanal endoscopic ear surgery training, planning, and rehearsal via advanced vision-language models",Other,PolyU,Hong Kong Polytechnic University,School of Nursing,2026-02-02,FALSE,260126009,Full-time,,,https://jobs.polyu.edu.hk/job_detail.php?job=260126009,"Interactive virtual environments for transcanal endoscopic ear surgery training, planning, and rehearsal via advanced vision-language models — School of Nursing. See https://jobs.polyu.edu.hk/job_detail.php?job=260126009 for full details."
POLYU-260126008,Patient-centered care research (YTD),Other,PolyU,Hong Kong Polytechnic University,School of Nursing,2026-02-02,FALSE,260126008,Full-time,,,https://jobs.polyu.edu.hk/job_detail.php?job=260126008,Patient-centered care research (YTD) — School of Nursing. See https://jobs.polyu.edu.hk/job_detail.php?job=260126008 for full details.
POLYU-260126007,"Personalized dysphagia rehabilitation via AI models driven by data, knowledge and interactions.",Other,PolyU,Hong Kong Polytechnic University,School of Nursing,2026-02-02,FALSE,260126007,Full-time,,,https://jobs.polyu.edu.hk/job_detail.php?job=260126007,"Personalized dysphagia rehabilitation via AI models driven by data, knowledge and interactions. — School of Nursing. See https://jobs.polyu.edu.hk/job_detail.php?job=260126007 for full details."
POLYU-260126006,Research Associate / Research Assistant (Full-time/Part-time),Other,PolyU,Hong Kong Polytechnic University,School of Nursing,2026-02-02,FALSE,260126006,Full-time,,,https://jobs.polyu.edu.hk/job_detail.php?job=260126006,Research Associate / Research Assistant (Full-time/Part-time) — School of Nursing. See https://jobs.polyu.edu.hk/job_detail.php?job=260126006 for full details.
POLYU-260126005,STA AI simulation algorithm research project - AI multiple strategy simulated fund manager,Other,PolyU,Hong Kong Polytechnic University,School of Accounting and Finance,2026-02-02,FALSE,260126005,Full-time,,,https://jobs.polyu.edu.hk/job_detail.php?job=260126005,STA AI simulation algorithm research project - AI multiple strategy simulated fund manager — School of Accounting and Finance. See https://jobs.polyu.edu.hk/job_detail.php?job=260126005 for full details.
POLYU-260126004,Methodologies for rapid reconfiguration of human-robot collaborative assembly production line towards human-centric smart manufacturing,Other,PolyU,Hong Kong Polytechnic University,Department of Industrial and Systems Engineering,2026-04-20,TRUE,260126004,Full-time,,,https://jobs.polyu.edu.hk/job_detail.php?job=260126004,Methodologies for rapid reconfiguration of human-robot collaborative assembly production line towards human-centric smart manufacturing — Department of Industrial and Systems Engineering. See https://jobs.polyu.edu.hk/job_detail.php?job=260126004 for full details.
POLYU-260126002,Design digital nudges to promote pro-environmental choices in travel,Other,PolyU,Hong Kong Polytechnic University,School of Hotel and Tourism Management,2026-02-02,FALSE,260126002,Full-time,,,https://jobs.polyu.edu.hk/job_detail.php?job=260126002,Design digital nudges to promote pro-environmental choices in travel — School of Hotel and Tourism Management. See https://jobs.polyu.edu.hk/job_detail.php?job=260126002 for full details.
POLYU-260126001,Policy research on Legal Entity Identifier and electronic authentication,Other,PolyU,Hong Kong Polytechnic University,Department of Building Environment and Energy Engineering,2026-06-30,TRUE,260126001,Full-time,,,https://jobs.polyu.edu.hk/job_detail.php?job=260126001,Policy research on Legal Entity Identifier and electronic authentication — Department of Building Environment and Energy Engineering. See https://jobs.polyu.edu.hk/job_detail.php?job=260126001 for full details.
POLYU-260123014,Principal Project Fellow / Senior Project Fellow / Project Fellow / Research Associate / Project Associate / Research Assistant / Project Assistant (Full-time/Part-time),Other,PolyU,Hong Kong Polytechnic University,Department of Rehabilitation Sciences,2026-01-30,FALSE,260123014,Full-time,,,https://jobs.polyu.edu.hk/job_detail.php?job=260123014,Principal Project Fellow / Senior Project Fellow / Project Fellow / Research Associate / Project Associate / Research Assistant / Project Assistant (Full-time/Part-time) — Department of Rehabilitation Sciences. See https://jobs.polyu.edu.hk/job_detail.php?job=260123014 for full details.
POLYU-260123008,KCube-VRS: Bridging technical skills to professional readiness via KG-augmented AIGC-powered VR,Other,PolyU,Hong Kong Polytechnic University,Department of Computing,2026-02-02,FALSE,260123008,Full-time,,,https://jobs.polyu.edu.hk/job_detail.php?job=260123008,KCube-VRS: Bridging technical skills to professional readiness via KG-augmented AIGC-powered VR — Department of Computing. See https://jobs.polyu.edu.hk/job_detail.php?job=260123008 for full details.
POLYU-260123007,Postdoctoral Fellow / Research Assistant / Project Assistant (Full-time/Part-time),Postdoc,PolyU,Hong Kong Polytechnic University,Department of Computing,2026-01-30,FALSE,260123007,Full-time,,,https://jobs.polyu.edu.hk/job_detail.php?job=260123007,Postdoctoral Fellow / Research Assistant / Project Assistant (Full-time/Part-time) — Department of Computing. See https://jobs.polyu.edu.hk/job_detail.php?job=260123007 for full details.
POLYU-260123005,AI-based medical image analysis with privacy protection technology,Other,PolyU,Hong Kong Polytechnic University,PolyU Academy for Artificial Intelligence,2026-01-30,FALSE,260123005,Full-time,,,https://jobs.polyu.edu.hk/job_detail.php?job=260123005,AI-based medical image analysis with privacy protection technology — PolyU Academy for Artificial Intelligence. See https://jobs.polyu.edu.hk/job_detail.php?job=260123005 for full details.
POLYU-260123003,"Reviving the past: AI-empowered, semantic-enhanced restoration and 3D reconstruction of historical aerial photographs of Hong Kong",Other,PolyU,Hong Kong Polytechnic University,Department of Land Surveying and Geo-Informatics,2026-01-30,FALSE,260123003,Full-time,,,https://jobs.polyu.edu.hk/job_detail.php?job=260123003,"Reviving the past: AI-empowered, semantic-enhanced restoration and 3D reconstruction of historical aerial photographs of Hong Kong — Department of Land Surveying and Geo-Informatics. See https://jobs.polyu.edu.hk/job_detail.php?job=260123003 for full details."
POLYU-260123002,Hong Kong operational robot collaborative project – development of enhanced vision perception and environmental mapping system,Other,PolyU,Hong Kong Polytechnic University,Department of Land Surveying and Geo-Informatics,2026-01-30,FALSE,260123002,Full-time,,,https://jobs.polyu.edu.hk/job_detail.php?job=260123002,Hong Kong operational robot collaborative project – development of enhanced vision perception and environmental mapping system — Department of Land Surveying and Geo-Informatics. See https://jobs.polyu.edu.hk/job_detail.php?job=260123002 for full details.
POLYU-260122006,Postdoctoral Fellow / Research Assistant (Full-time / Part-time),Postdoc,PolyU,Hong Kong Polytechnic University,School of Fashion and Textiles,2026-01-29,FALSE,260122006,Full-time,,,https://jobs.polyu.edu.hk/job_detail.php?job=260122006,Postdoctoral Fellow / Research Assistant (Full-time / Part-time) — School of Fashion and Textiles. See https://jobs.polyu.edu.hk/job_detail.php?job=260122006 for full details.
POLYU-260122004,GEM-VR: GenAI-driven expressive arts therapy in virtual reality for enhancing youth’s mental well-being,Other,PolyU,Hong Kong Polytechnic University,Department of Applied Social Sciences,2026-02-01,FALSE,260122004,Full-time,,,https://jobs.polyu.edu.hk/job_detail.php?job=260122004,GEM-VR: GenAI-driven expressive arts therapy in virtual reality for enhancing youth’s mental well-being — Department of Applied Social Sciences. See https://jobs.polyu.edu.hk/job_detail.php?job=260122004 for full details.
POLYU-260122003,Project Associate / Research Associate / Project Assistant / Research Assistant,Other,PolyU,Hong Kong Polytechnic University,Department of Applied Social Sciences,2026-01-29,FALSE,260122003,Full-time,,,https://jobs.polyu.edu.hk/job_detail.php?job=260122003,Project Associate / Research Associate / Project Assistant / Research Assistant — Department of Applied Social Sciences. See https://jobs.polyu.edu.hk/job_detail.php?job=260122003 for full details.
POLYU-260122001,Migraine features and silent brain infarction in predicting stroke risk progression: A cohort study with neuroimaging analysis in Hong Kong Chinese women,Other,PolyU,Hong Kong Polytechnic University,School of Nursing,2026-01-29,FALSE,260122001,Full-time,,,https://jobs.polyu.edu.hk/job_detail.php?job=260122001,Migraine features and silent brain infarction in predicting stroke risk progression: A cohort study with neuroimaging analysis in Hong Kong Chinese women — School of Nursing. See https://jobs.polyu.edu.hk/job_detail.php?job=260122001 for full details.
POLYU-260121018,Design considerations of physical environment in Hong Kong long-term care facilities and social networks of residents with dementia: A participatory design approach,Other,PolyU,Hong Kong Polytechnic University,School of Design,2026-01-28,FALSE,260121018,Full-time,,,https://jobs.polyu.edu.hk/job_detail.php?job=260121018,Design considerations of physical environment in Hong Kong long-term care facilities and social networks of residents with dementia: A participatory design approach — School of Design. See https://jobs.polyu.edu.hk/job_detail.php?job=260121018 for full details.
